{
  "receipt_id": "11111111-1111-4111-8111-111111111111",
  "job_id": "22222222-2222-4222-8222-222222222222",
  "status": "ready",
  "is_current": true,
  "validation_errors": [],
  "missing_fields": [
    "attachments/attachment-demo"
  ],
  "warnings": [
    {
      "code": "attachment_unavailable",
      "path": "/attachments/0",
      "message": "模拟下载失败"
    }
  ],
  "retrospective_id": null,
  "capabilities": [
    "historical_summary",
    "partial_timeline"
  ]
}
