{
  "receipt_id": "11111111-1111-4111-8111-111111111111",
  "job_id": "22222222-2222-4222-8222-222222222222",
  "status": "ready",
  "is_current": true,
  "validation_errors": [],
  "missing_fields": [],
  "warnings": [],
  "retrospective_id": null,
  "capabilities": [
    "historical_summary",
    "complete_timeline"
  ]
}
